coach_team_name,coach_1_name,coach_1_naf,coach_2_name,coach_2_naf,coach_3_name,coach_3_naf,email,coach_1_race,coach_2_race,coach_3_race
Triplette 1,CoachA,1,CoachB,2,CoachC,3,triplette1@gmail.com,Amazons, Bretonnians, Chaos Dwarves
Triplette 2,CoachD,4,CoachE,5,CoachF,6,triplette2@gmail.com,Dark Elves, Dwarves, Lizardmen
Triplette 3,CoachG,7,CoachH,8,CoachI,9,triplette3@gmail.com,Norse, Orcs, Skaven
Triplette 4,CoachJ,10,CoachK,11,CoachL,12,triplette4@gmail.com, Undead, Wood Elves, Chaos Renegades
Triplette 5,CoachM,13,CoachN,14,CoachO,15,triplette5@gmail.com, Elf Union, High Elves, Humans
Triplette 6,CoachP,16,CoachQ,17,CoachR,18,triplette6@gmail.com, Khemri, Necromantic, Daemons of Khorne
Triplette 7,CoachS,19,CoachT,20,CoachU,21,triplette7@gmail.com, Chaos, Nurgle's Rotters, Slann
Triplette 8,CoachV,22,CoachW,23,CoachX,24,triplette8@gmail.com, Underworld Denizens, Vampires, Goblins
Triplette 9,CoachY,25,CoachZ,26,CoachAA,27,triplette9@gmail.com, Halflings, Ogres, Amazons